{
  "schemaVersion": "1.0.0",
  "harnessVersion": "v42.3-validation-v1",
  "runId": "20260827_214108_v42_3_FULLVALIDATION_720P",
  "profileId": "v42_3_shadow_720p_v1",
  "status": "COMPLETE",
  "automatedVerdict": "NO_GO",
  "finalVerdict": "NO_GO",
  "blockingReasons": [
    "case.BASELINE_METRICS: FAILED",
    "case.ZEROCOPY_METRICS: FAILED",
    "case.BASELINE_VISUAL: FAILED",
    "case.ZEROCOPY_VISUAL: FAILED",
    "comparison.relative: SKIP",
    "visual.review: PENDING"
  ],
  "createdUtc": "2026-08-27T12:41:08.2811115Z",
  "completedUtc": "2026-08-27T12:42:49.8524451Z",
  "identity": {
    "systemVersion": "v42.3",
    "installedVersion": "5.1.0-phase16.20.32-v42.3",
    "installedManifest": "D:\\KiwiAvatarSystem\\Phase16_20_32_v42_3_NATIVE_PLUGIN_DEVICE_LIFECYCLE_ROOTFIX.json",
    "installedManifestSha256": "c0e37acb4d2c74fa5d3c90d459b6f03a3eeb584ab3ddb36383440c855bf879aa",
    "unityVersion": "6000.0.80f1",
    "scene": "Assets/Scenes/Face Landmark Detection.unity",
    "graphicsApi": "Direct3D12",
    "developmentBuild": true,
    "resolution": {
      "label": "720P",
      "width": 1280,
      "height": 720
    },
    "modelPath": "D:\\KiwiAvatarSystem\\Assets\\KiwiAvatarSystem\\Resources\\KiwiFaceLandmarkInference.onnx",
    "modelSha256": "ed487104519b0a88cb2cb2ec3678e183f447fb9dd63560998e960ffbaa8fb335",
    "preflightContractVersion": "5.1.0-phase16.19.5.1",
    "runtimeHarnessVersion": "KIWI_V5_1_PHASE16_20_32_V42_3_AUTOMATED_VALIDATION_V1"
  },
  "environment": {
    "machineName": "DESKTOP-THHVR4N",
    "os": "Microsoft Windows NT 10.0.26200.0",
    "powerShellVersion": "7.6.4",
    "gpu": {
      "index": 0,
      "uuid": "GPU-6efc5d27-d766-eeac-cb81-8aa14cebbfa3",
      "name": "NVIDIA GeForce RTX 4090",
      "driverVersion": "610.88"
    },
    "tools": [
      {
        "name": "Unity",
        "path": "C:\\Program Files\\Unity\\Hub\\Editor\\6000.0.80f1\\Editor\\Unity.exe",
        "version": "6000.0.80f1",
        "sha256": "7fc68434f4fccf2781648c398fbaa4e8adfb568251605e990d887fe36cf1376f"
      },
      {
        "name": "ffmpeg",
        "path": "D:\\KiwiAvatarSystem\\Tools\\ffmpeg\\bin\\ffmpeg.exe",
        "version": "ffmpeg version 2026-08-09-git-6bbc22dc09-full_build-www.gyan.dev Copyright (c) 2000-2026 the FFmpeg developers",
        "sha256": "15f13735c57918b20dbb5e63517ba4a312ed1a271d41a583a68b60129c481e1d"
      },
      {
        "name": "ffprobe",
        "path": "D:\\KiwiAvatarSystem\\Tools\\ffmpeg\\bin\\ffprobe.exe",
        "version": "ffprobe version 2026-08-09-git-6bbc22dc09-full_build-www.gyan.dev Copyright (c) 2007-2026 the FFmpeg developers",
        "sha256": "4871a1d367f45a2128bcf4861fa9281aace31507db03f107322bba926bdbf2f9"
      },
      {
        "name": "nvidia-smi",
        "path": "C:\\Windows\\System32\\nvidia-smi.exe",
        "version": "NVIDIA-SMI version  : 610.88",
        "sha256": "bcff816616b9e2df104e601ae9b0ac116003a66e27e937bc09f79f29afe342d0"
      }
    ],
    "thresholdsSha256": "29dd994308c141b499cb34705346c9a9804c287da9ece72060834ee0576b1743",
    "reportSchemaSha256": "82e3c93522eb9e03e295961bc6cb0458684d18af85d289f3243ed95730749d34"
  },
  "transaction": {
    "state": "COMMITTED",
    "startedUtc": "2026-08-27T12:41:08.4315511Z",
    "updatedUtc": "2026-08-27T12:41:27.9985261Z",
    "targets": [
      {
        "path": "D:\\KiwiAvatarSystem\\Assets\\Plugins\\KiwiOrtDirectML\\x86_64\\KiwiOrtDmlZeroCopyBridge.dll.meta",
        "preSha256": "3b999cef522bd3ba5aec24f8b639d20689a6ed7c8dd13e9d805129e9303091e2",
        "postSha256": "3b999cef522bd3ba5aec24f8b639d20689a6ed7c8dd13e9d805129e9303091e2",
        "backupPath": "D:\\KiwiAvatarSystem\\ValidationRuns\\20260827_214108_v42_3_FULLVALIDATION_720P\\Transaction\\Assets_Plugins_KiwiOrtDirectML_x86_64_KiwiOrtDmlZeroCopyBridge.dll.meta.backup",
        "restoreSha256": null
      },
      {
        "path": "D:\\KiwiAvatarSystem\\ProjectSettings\\ProjectSettings.asset",
        "preSha256": "88cb3f68f275e1a7dcbf1fea8c59d123f50743c6f93b0f861e1fd653865ec6aa",
        "postSha256": "88cb3f68f275e1a7dcbf1fea8c59d123f50743c6f93b0f861e1fd653865ec6aa",
        "backupPath": "D:\\KiwiAvatarSystem\\ValidationRuns\\20260827_214108_v42_3_FULLVALIDATION_720P\\Transaction\\ProjectSettings_ProjectSettings.asset.backup",
        "restoreSha256": null
      }
    ],
    "rollbackAttempted": false,
    "rollbackVerified": false
  },
  "cases": [
    {
      "caseId": "BASELINE_METRICS",
      "order": 1,
      "mode": "BASELINE",
      "purpose": "METRICS",
      "status": "FAILED",
      "startedUtc": "08/27/2026 12:41:28",
      "completedUtc": "08/27/2026 12:41:35",
      "environment": {
        "KIWI_VALIDATION_RUN_ID": "20260827_214108_v42_3_FULLVALIDATION_720P",
        "KIWI_VALIDATION_CASE_ID": "BASELINE_METRICS",
        "KIWI_VALIDATION_TOKEN": "20260827_214108_v42_3_FULLVALIDATION_720P-BASELINE_METRICS-789fee38fdc6471f81daa16ee7403650",
        "KIWI_VALIDATION_MODE": "BASELINE",
        "KIWI_VALIDATION_PURPOSE": "METRICS",
        "KIWI_ORT_DML_ZERO_COPY_SHADOW": "0"
      },
      "process": {
        "executable": "D:\\KiwiAvatarSystem\\ValidationRuns\\20260827_213738_v42_3_FULLVALIDATION_720P\\Build\\KiwiAvatarSystem_v42_3_DX12_AUTOMATED_VALIDATION.exe",
        "arguments": [
          "-force-d3d12",
          "-screen-fullscreen",
          "0",
          "-screen-width",
          "1280",
          "-screen-height",
          "720",
          "-logFile",
          "D:\\KiwiAvatarSystem\\ValidationRuns\\20260827_214108_v42_3_FULLVALIDATION_720P\\BASELINE_METRICS\\Logs\\KiwiStandalonePlayer_20260827_214108_v42_3_FULLVALIDATION_720P-BASELINE_METRICS-789fee38fdc6471f81daa16ee7403650.log",
          "-crash-report-folder",
          "D:\\KiwiAvatarSystem\\ValidationRuns\\20260827_214108_v42_3_FULLVALIDATION_720P\\BASELINE_METRICS\\Crash"
        ],
        "pid": 4480,
        "startSucceeded": true,
        "startupSurvived": true,
        "readyMarkerSeen": true,
        "completionMarkerSeen": false,
        "receiptCommitted": true,
        "exitObserved": true,
        "exitCode": 2,
        "forcedTermination": false,
        "crashArtifactCount": 0
      },
      "metrics": {},
      "gates": [
        {
          "id": "artifact.required.FRAME_COMPARISON_CSV",
          "status": "FAIL",
          "expected": "exactly one existing, hash-matched, token-matched artifact",
          "actual": "count=0",
          "evidence": [
            "count=0"
          ]
        },
        {
          "id": "artifact.required.GPU_CSV",
          "status": "FAIL",
          "expected": "exactly one existing, hash-matched, token-matched artifact",
          "actual": "count=0",
          "evidence": [
            "count=0"
          ]
        },
        {
          "id": "artifact.required.GPU_META",
          "status": "PASS",
          "expected": "exactly one existing, hash-matched, token-matched artifact",
          "actual": "count=1; path=D:\\KiwiAvatarSystem\\ValidationRuns\\20260827_214108_v42_3_FULLVALIDATION_720P\\BASELINE_METRICS\\GPU\\KiwiGpuTelemetry_20260827_214108_v42_3_FULLVALIDATION_720P-BASELINE_METRICS-789fee38fdc6471f81daa16ee7403650.meta.json; sha256=6ba527da1c13ef1f0c74037ca54a5b034d9ca09e83d0464d6d1ad0a7ff4de75d; tokenMatched=True",
          "evidence": [
            "count=1",
            "path=D:\\KiwiAvatarSystem\\ValidationRuns\\20260827_214108_v42_3_FULLVALIDATION_720P\\BASELINE_METRICS\\GPU\\KiwiGpuTelemetry_20260827_214108_v42_3_FULLVALIDATION_720P-BASELINE_METRICS-789fee38fdc6471f81daa16ee7403650.meta.json",
            "sha256=6ba527da1c13ef1f0c74037ca54a5b034d9ca09e83d0464d6d1ad0a7ff4de75d",
            "tokenMatched=True"
          ]
        },
        {
          "id": "artifact.required.PLAYER_LOG",
          "status": "PASS",
          "expected": "exactly one existing, hash-matched, token-matched artifact",
          "actual": "count=1; path=D:\\KiwiAvatarSystem\\ValidationRuns\\20260827_214108_v42_3_FULLVALIDATION_720P\\BASELINE_METRICS\\Logs\\KiwiStandalonePlayer_20260827_214108_v42_3_FULLVALIDATION_720P-BASELINE_METRICS-789fee38fdc6471f81daa16ee7403650.log; sha256=0f1cc0c131a762f0d7e514a1a826988a04238282e370e60175358c9eece474d8; tokenMatched=True",
          "evidence": [
            "count=1",
            "path=D:\\KiwiAvatarSystem\\ValidationRuns\\20260827_214108_v42_3_FULLVALIDATION_720P\\BASELINE_METRICS\\Logs\\KiwiStandalonePlayer_20260827_214108_v42_3_FULLVALIDATION_720P-BASELINE_METRICS-789fee38fdc6471f81daa16ee7403650.log",
            "sha256=0f1cc0c131a762f0d7e514a1a826988a04238282e370e60175358c9eece474d8",
            "tokenMatched=True"
          ]
        },
        {
          "id": "artifact.required.RUNTIME_VALIDATION_JSON",
          "status": "FAIL",
          "expected": "exactly one existing, hash-matched, token-matched artifact",
          "actual": "count=0",
          "evidence": [
            "count=0"
          ]
        },
        {
          "id": "artifact.required.CASE_RECEIPT_JSON",
          "status": "PASS",
          "expected": "exactly one existing, hash-matched, token-matched artifact",
          "actual": "count=1; path=D:\\KiwiAvatarSystem\\ValidationRuns\\20260827_214108_v42_3_FULLVALIDATION_720P\\BASELINE_METRICS\\Receipts\\KiwiValidationReceipt_20260827_214108_v42_3_FULLVALIDATION_720P-BASELINE_METRICS-789fee38fdc6471f81daa16ee7403650.json; sha256=a96947571c9da99fd5dbbc226ab5bdc2aef30e898f465b2ae6547d68899c6d3a; tokenMatched=True",
          "evidence": [
            "count=1",
            "path=D:\\KiwiAvatarSystem\\ValidationRuns\\20260827_214108_v42_3_FULLVALIDATION_720P\\BASELINE_METRICS\\Receipts\\KiwiValidationReceipt_20260827_214108_v42_3_FULLVALIDATION_720P-BASELINE_METRICS-789fee38fdc6471f81daa16ee7403650.json",
            "sha256=a96947571c9da99fd5dbbc226ab5bdc2aef30e898f465b2ae6547d68899c6d3a",
            "tokenMatched=True"
          ]
        },
        {
          "id": "artifact.rows.FRAME_COMPARISON_CSV",